{"artifact_sha256":"b0f76c2ac2fcf9ed8eaf139cb82ed99ad896ffd5fc5f10a4d0e98cbfff0ce73e","generator":{"name":"structural","ruleset_sha256":"8aadebd8ba80e0e523cfcefec287c63b3182269462d950447f0d98f58cfbb253","version":1},"inputs":{"metadata":[{"git_oid":"981675a34cf4ea8281fb460ee034a497d20fba32","path":"Cargo.toml","read":false,"reason":"capped_size","size":262145},{"git_oid":"46a7290339ca771564f451fc22bedf667959b699","path":"lib/setup.cfg","read":true,"sha256":"b4360bbb7386e8bee63177dce9ca3645e9f4258ac745abaa805546b4c7857b34","size":72},{"git_oid":"76edda3f26133b422da4bb4aa9601907a3dae302","path":"package.json","read":true,"sha256":"89b06feb529add695fdfab605feb82c271665da348b0456663128e1fe8f1fd4c","size":127},{"git_oid":"098afa4d1ca5776c3d01a86be7ba97f4362302bc","path":"pyproject.toml","read":true,"sha256":"38d64a18441b75bc5ffa30e00c0f083f3cc0b8a23a8e5689cb7250b3fbe9d684","size":4}],"path_listing_sha256":"a79ae612f255a06a52c2a8e9b02aecb357fb155339e72fda51e17278e1c48fae"},"limits":{"metadata_blob_bytes":{"limit":262144,"skipped":1},"metadata_bytes":{"capped":false,"limit":2097152,"read":203},"tracked_paths":{"capped":false,"seen":8}},"object_format":"sha1","schema":"aew/codebase-map/v1","sections":{"build_descriptors":{"items":[{"kind":"rust","path":"Cargo.toml","status":"capped_size"},{"kind":"python","path":"lib/setup.cfg","status":"parsed"},{"kind":"node","path":"package.json","status":"lfs_pointer"},{"kind":"python","path":"pyproject.toml","status":"parse_failed"}],"omitted":0},"directories":{"max_depth":3,"rows":[{"depth":0,"files":7,"label":"root","languages":["INI","JSON","Python","TOML"],"path":"."},{"depth":1,"files":1,"label":"source","languages":["INI"],"path":"lib"},{"depth":1,"files":0,"label":"unknown","languages":[],"path":"m"}],"rows_omitted":0,"rows_total":3,"submodules":[{"object":"bbbbbbbbbbbbbbbbbbbbbbbbbbbbbbbbbbbbbbbb","path":"m/sub"}],"submodules_omitted":0},"entry_point_candidates":{"items":[{"label":"declared","name":"t","path":"lib/setup.cfg","target":"t.main:run"}],"omitted":0},"generated_and_vendor":{"items":[],"omitted":0},"languages":{"counts":{"INI":1,"JSON":1,"Python":2,"TOML":2},"unknown_extensions":[],"unknown_extensions_omitted":0,"unknown_files":0},"limits_and_omissions":{"caps_hit":[],"lfs_pointers":["package.json"],"lfs_pointers_omitted":0,"metadata_unread":1,"non_utf8_names":1,"parse_failures":[{"code":"invalid_toml","path":"pyproject.toml"}],"parse_failures_omitted":0,"submodules":1,"symlinks":1,"unknown_extension_files":0,"unsupported":[],"unsupported_omitted":0},"semantic_prerequisites":{"items":[],"omitted":0},"test_candidates":{"items":[{"kind":"runner_config","path":"lib/setup.cfg","runner":"pytest","source":"declared"}],"omitted":0}},"source_revision":"cccccccccccccccccccccccccccccccccccccccc","source_tree":"eeeeeeeeeeeeeeeeeeeeeeeeeeeeeeeeeeeeeeee"}