{"artifact_sha256":"c5a4b76f955668143a7502e0fc28bdb9bf12fd92fd588140258cdb57666c3e3d","generator":{"name":"structural","ruleset_sha256":"8aadebd8ba80e0e523cfcefec287c63b3182269462d950447f0d98f58cfbb253","version":1},"inputs":{"metadata":[{"git_oid":"8411675d2e45f86f6bc2f70125d0ea7c0ceb0efb","path":".gitattributes","read":true,"sha256":"b895105ff2868fecaf14763edc7cce3cffbb6c0a15a430517a693da0ea771a37","size":69},{"git_oid":"054cffe6bf57f016917a02eda367b0f83d17fb27","path":"deep/Cargo.toml","read":true,"sha256":"75c63741e44f7022c7120c21cee3ec8d96ee9329591d148e9416ef8a3f178446","size":64},{"git_oid":"fb9fcd1d2980d2671c763e584c9283820ea79ee4","path":"pyproject.toml","read":true,"sha256":"c1896be8974b35d20ee9e7e695bdde6c89cfbc8ddc83a569f0e0643e95a6bd5d","size":121},{"git_oid":"c69f74e27e70f28b05ce1cbc629d72852ef50370","path":"ui/.gitattributes","read":true,"sha256":"6fd8d94f15cbf8444731a2d2f26f805957b1274740bcf5277fd00f8769253c46","size":27},{"git_oid":"5d8d6d12c7d81eb66a3448da720e31efb3a7386f","path":"ui/package.json","read":true,"sha256":"1677285ed94dc1e7c785d560c50a1b1106f7ddfdc11a4b72c01e5e7c22d65d17","size":97}],"path_listing_sha256":"4226db2d7b2c4fa1b47e37712c0697b0519a5ca607839ad73ac1dbf023356fda"},"limits":{"metadata_blob_bytes":{"limit":262144,"skipped":0},"metadata_bytes":{"capped":false,"limit":2097152,"read":378},"tracked_paths":{"capped":false,"seen":20}},"object_format":"sha1","schema":"aew/codebase-map/v1","sections":{"build_descriptors":{"items":[{"kind":"rust","path":"deep/Cargo.toml","status":"parsed"},{"kind":"python","path":"pyproject.toml","status":"parsed"},{"kind":"node","path":"ui/package.json","status":"parsed"}],"omitted":0},"directories":{"max_depth":3,"rows":[{"depth":0,"files":19,"label":"root","languages":["C","Go","JSON","JavaScript","Markdown","Python","TOML"],"path":"."},{"depth":1,"files":4,"label":"unknown","languages":["JSON","JavaScript"],"path":"ui"},{"depth":1,"files":3,"label":"source","languages":["Python"],"path":"src"},{"depth":2,"files":3,"label":"unknown","languages":["Python"],"path":"src/demo"},{"depth":1,"files":2,"label":"unknown","languages":["Go","TOML"],"path":"deep"},{"depth":1,"files":2,"label":"tests","languages":["Python"],"path":"tests"},{"depth":1,"files":1,"label":"assets","languages":[],"path":"assets"},{"depth":2,"files":1,"label":"unknown","languages":["Go"],"path":"deep/a"},{"depth":3,"files":1,"label":"unknown","languages":["Go"],"path":"deep/a/b"},{"depth":1,"files":1,"label":"unknown","languages":["JSON"],"path":"native"},{"depth":1,"files":1,"label":"unknown","languages":["Python"],"path":"proto"},{"depth":2,"files":1,"label":"vendor","languages":["JavaScript"],"path":"ui/node_modules"},{"depth":3,"files":1,"label":"unknown","languages":["JavaScript"],"path":"ui/node_modules/left"},{"depth":1,"files":1,"label":"vendor","languages":["C"],"path":"vendor"},{"depth":1,"files":0,"label":"unknown","languages":[],"path":"sub"}],"rows_omitted":0,"rows_total":15,"submodules":[{"object":"aaaaaaaaaaaaaaaaaaaaaaaaaaaaaaaaaaaaaaaa","path":"sub/module"}],"submodules_omitted":0},"entry_point_candidates":{"items":[{"label":"convention","path":"src/demo/__main__.py","rule":"*/__main__.py"},{"label":"declared","name":"tool","path":"deep/Cargo.toml","target":"src/tool.rs"},{"label":"declared","name":"demo","path":"pyproject.toml","target":"demo.cli:main"},{"label":"declared","name":"main","path":"ui/package.json","target":"index.js"},{"label":"declared","name":"webctl","path":"ui/package.json","target":"bin/ctl.js"}],"omitted":0},"generated_and_vendor":{"items":[{"files":1,"kind":"generated","pattern":"*_pb2.py","source":"convention"},{"files":1,"kind":"vendored","pattern":"ui/node_modules/","source":"convention"},{"files":1,"kind":"vendored","pattern":"vendor/","source":"convention"},{"attributes_file":"ui/.gitattributes","kind":"generated","pattern":"dist/**","source":"gitattributes"},{"attributes_file":".gitattributes","kind":"generated","pattern":"gen/**","source":"gitattributes"},{"attributes_file":".gitattributes","kind":"vendored","pattern":"third/**","source":"gitattributes"}],"omitted":0},"languages":{"counts":{"C":1,"Go":1,"JSON":2,"JavaScript":2,"Markdown":1,"Python":6,"TOML":2},"unknown_extensions":[{"extension":"","files":2},{"extension":".xyz","files":1}],"unknown_extensions_omitted":0,"unknown_files":3},"limits_and_omissions":{"caps_hit":[],"lfs_pointers":[],"lfs_pointers_omitted":0,"metadata_unread":0,"non_utf8_names":0,"parse_failures":[],"parse_failures_omitted":0,"submodules":1,"symlinks":1,"unknown_extension_files":3,"unsupported":[],"unsupported_omitted":0},"semantic_prerequisites":{"items":[{"kind":"compile_database","path":"native/compile_commands.json","source":"convention"},{"kind":"pyright","path":"pyproject.toml","source":"declared"}],"omitted":0},"test_candidates":{"items":[{"files":2,"kind":"directory","path":"tests"},{"files":1,"kind":"file_pattern","pattern":"test_*.py"},{"kind":"runner_config","path":"pyproject.toml","runner":"pytest","source":"declared"},{"kind":"runner_config","path":"tests/conftest.py","runner":"pytest","source":"convention"},{"kind":"runner_config","path":"ui/package.json","runner":"npm test","source":"declared"}],"omitted":0}},"source_revision":"cccccccccccccccccccccccccccccccccccccccc","source_tree":"eeeeeeeeeeeeeeeeeeeeeeeeeeeeeeeeeeeeeeee"}